vintage,vintage_year,rank,previous_rank,award_year,style_name,price_euros,bottle_volume_ml
Casanova di Neri Tenuta Nuova Brunello di Montalcino 2001,2001,4,4,2016,Italian Brunello,420.0,750
Emidio Pepe Montepulciano d'Abruzzo 2001,2001,2,2,2017,Italian Montepulciano d'Abruzzo,248.25,750
Emidio Pepe Montepulciano d'Abruzzo 2001,2001,2,2,2019,Italian Montepulciano d'Abruzzo,248.25,750
Gaja Sperss Barolo 2004,2004,1,1,2018,Italian Nebbiolo,618.75,750
Paolo Scavino Bric Dël Fiasc Barolo 2005,2005,9,9,2016,Italian Barolo,221.25,750
Paolo Scavino Bric Dël Fiasc Barolo 2005,2005,8,8,2017,Italian Barolo,221.25,750
Paolo Scavino Bric Dël Fiasc Barolo 2005,2005,9,9,2018,Italian Barolo,221.25,750
Paolo Scavino Bric Dël Fiasc Barolo 2005,2005,7,7,2020,Italian Barolo,221.25,750
Louis Roederer Cristal Brut Champagne (Millésimé) 1999,1999,5,5,2019,French Champagne Vintage,1900.0,1500
Louis Roederer Cristal Brut Champagne (Millésimé) 1999,1999,5,5,2020,French Champagne Vintage,1900.0,1500
Château Lafite Rothschild Pauillac (Premier Grand Cru Classé) 2003,2003,2,2,2019,Bordeaux Pauillac,1900.0,750
Château Lafite Rothschild Pauillac (Premier Grand Cru Classé) 2003,2003,2,2,2020,Bordeaux Pauillac,1900.0,750
Château Rayas Châteauneuf-du-Pape 2006,2006,3,3,2019,Southern Rhône Châteauneuf-du-Pape Red,3308.75,750
Château Rayas Châteauneuf-du-Pape 2006,2006,1,1,2020,Southern Rhône Châteauneuf-du-Pape Red,3308.75,750
Dal Forno Romano Amarone della Valpolicella Monte Lodoletta 2003,2003,4,4,2018,Italian Amarone,683.75,750
Dal Forno Romano Valpolicella Superiore Monte Lodoletta 2004,2004,1,1,2016,Italian Valpolicella Red,243.75,750
Dal Forno Romano Valpolicella Superiore Monte Lodoletta 2004,2004,2,2,2017,Italian Valpolicella Red,243.75,750
Antinori Tenuta Tignanello 'Solaia' 1997,1997,2,2,2016,Central Italy Red,1473.75,1500
Antinori Tenuta Tignanello 'Solaia' 1997,1997,3,3,2017,Central Italy Red,1473.75,1500
Renato Ratti Barolo Rocche 2006,2006,9,9,2017,Italian Barolo,208.75,750
Dal Forno Romano Amarone della Valpolicella Monte Lodoletta 2008,2008,2,2,2020,Italian Amarone,697.5,750
Salon Le Mesnil Blanc de Blancs (Cuvée S) Brut Champagne 1996,1996,7,7,2016,French Champagne,2882.5,750
Salon Le Mesnil Blanc de Blancs (Cuvée S) Brut Champagne 1996,1996,3,3,2018,French Champagne,2882.5,750
Salon Le Mesnil Blanc de Blancs (Cuvée S) Brut Champagne 1996,1996,3,3,2019,French Champagne Vintage,2882.5,750
Salon Le Mesnil Blanc de Blancs (Cuvée S) Brut Champagne 1996,1996,1,1,2020,French Champagne Vintage,2882.5,750
Antinori Tignanello 1998,1998,4,4,2018,Tuscan Red,820.0,1500
Château La Fleur-Pétrus Pomerol 2010,2010,4,4,2019,Bordeaux Pomerol,576.25,750
Château La Fleur-Pétrus Pomerol 2010,2010,3,3,2020,Bordeaux Pomerol,576.25,750
Domaine des Lambrays Clos des Lambrays Grand Cru 2009,2009,5,5,2017,Burgundy Red,896.25,750
Pio Cesare Ornato Barolo 2008,2008,3,3,2016,Italian Barolo,178.75,750
Gaja Barbaresco 1997,1997,1,1,2016,Italian Barbaresco,597.5,750
Gaja Barbaresco 1998,1998,1,1,2018,Italian Barbaresco,470.0,750
Le Macchiole Messorio 2008,2008,7,7,2018,Tuscan Red,420.0,750
Château La Fleur-Pétrus Pomerol 1998,1998,4,4,2017,Bordeaux Pomerol,683.75,750
Biondi-Santi Brunello di Montalcino Riserva 2008,2008,6,6,2018,Italian Brunello,1478.75,750
Château Gazin Pomerol 2009,2009,10,10,2019,Bordeaux Pomerol,155.0,750
Antinori Tenuta Guado al Tasso Bolgheri Superiore 1997,1997,4,4,2020,Italian Bolgheri,310.0,750
Dal Forno Romano Amarone della Valpolicella Monte Lodoletta 2006,2006,2,2,2017,Italian Amarone,616.25,750
Ceretto Barolo Bricco Rocche 2006,2006,5,5,2019,Italian Barolo,325.0,750
Château Clinet Pomerol 2009,2009,2,2,2019,Bordeaux Pomerol,762.0,750
Château Clinet Pomerol 2009,2009,5,5,2020,Bordeaux Pomerol,762.0,750
Antinori Tenuta Tignanello 'Solaia' 2009,2009,5,5,2016,Central Italy Red,705.0,750
Antinori Tenuta Tignanello 'Solaia' 2009,2009,3,3,2019,Tuscan Red,705.0,750
Antinori Tenuta Tignanello 'Solaia' 2009,2009,2,2,2020,Tuscan Red,705.0,750
Château Pontet-Canet Pauillac (Grand Cru Classé) 2009,2009,5,5,2018,Bordeaux Pauillac,597.5,750
Château Pontet-Canet Pauillac (Grand Cru Classé) 2009,2009,6,6,2019,Bordeaux Pauillac,597.5,750
Castello del Terriccio Lupicaia 2004,2004,5,5,2018,Tuscan Red,256.25,750
Château Trotanoy Pomerol 2000,2000,8,8,2020,Bordeaux Pomerol,790.0,750
Tenuta San Guido Sassicaia 1988,1988,2,2,2018,Italian Bolgheri,2668.75,1500
Ceretto Barolo Bricco Rocche 2005,2005,5,5,2018,Italian Barolo,273.75,750
Château Margaux Château Margaux (Premier Grand Cru Classé) 2010,2010,1,1,2019,Bordeaux Margaux,1077.51,750
Krug Vintage 2002,2002,7,7,2018,French Champagne,1800.0,1500
Krug Vintage 2002,2002,3,3,2020,French Champagne Vintage,1800.0,1500
Ornellaia Bolgheri Superiore 2005,2005,1,1,2019,Italian Bolgheri,425.0,750
Ornellaia Bolgheri Superiore 2005,2005,2,2,2020,Italian Bolgheri,425.0,750
Ornellaia Bolgheri Superiore 2007,2007,2,2,2016,Italian Bolgheri,533.75,750
Krug Rosé,N.V.,5,5,2019,French Champagne N.V.,349.0,750
Krug Rosé,N.V.,7,7,2020,French Champagne N.V.,349.0,750
Krug Vintage 1996,1996,3,3,2017,French Champagne,1473.75,750
Borgogno Barolo Riserva 1982,1982,4,4,2018,Italian Barolo,470.0,750
Borgogno Barolo Riserva 1982,1982,2,2,2019,Italian Barolo,470.0,750
Borgogno Barolo Riserva 1982,1982,3,3,2020,Italian Barolo,470.0,750
Laurent-Perrier Grand Siècle Champagne (Grande Cuvée),N.V.,10,10,2019,French Champagne N.V.,183.7,750
La Grange des Pères Vin de Pays de l'Hérault 2011,2011,1,1,2016,Languedoc-Roussillon White,683.75,750
Château Rayas Châteauneuf-du-Pape 2001,2001,1,1,2016,Southern Rhône Red,3395.0,750
Château Rayas Châteauneuf-du-Pape 2001,2001,1,1,2017,Southern Rhône Red,3395.0,750
Chateau Palmer Grand Vin de Château Palmer (Grand Cru Classé) 2010,2010,2,2,2019,Bordeaux Margaux,832.5,750
Chateau Palmer Grand Vin de Château Palmer (Grand Cru Classé) 2010,2010,2,2,2020,Bordeaux Margaux,832.5,750
Krug Clos du Mesnil 2000,2000,6,6,2016,French Champagne,3096.25,750
Château Rayas Châteauneuf-du-Pape 2005,2005,1,1,2018,Southern Rhône Châteauneuf-du-Pape Red,3181.25,750
Château Ducru-Beaucaillou Saint-Julien (Grand Cru Classé) 2010,2010,2,2,2019,Bordeaux Saint-Julien,533.75,750
Château Ducru-Beaucaillou Saint-Julien (Grand Cru Classé) 2010,2010,1,1,2020,Bordeaux Saint-Julien,533.75,750
Burmester Tordiz 40 Year Old Tawny Port,N.V.,1,1,2020,Portuguese Tawny Port,337.5,750
La Spinetta Vürsù Barolo Campè 2004,2004,4,4,2016,Northern Italy Red,232.5,750
Dal Forno Romano Valpolicella Superiore Monte Lodoletta 2007,2007,3,3,2018,Italian Valpolicella Red,243.75,750
Trimbach Clos Sainte Hune Riesling Alsace 2012,2012,1,1,2019,Alsace Riesling,600.0,1500
Biondi-Santi Brunello di Montalcino 2000,2000,10,10,2018,Italian Brunello,331.25,750
Château Latour Grand Vin Pauillac (Premier Grand Cru Classé) 2003,2003,2,2,2018,Bordeaux Pauillac,1686.25,750
Ornellaia Bolgheri Superiore 2010,2010,4,4,2017,Italian Bolgheri,597.5,750
Château Suduiraut Sauternes (Premier Grand Cru Classé) 2007,2007,4,4,2018,Bordeaux Sauternes,49.9,750
Ruinart Dom Ruinart Blanc de Blancs Brut Champagne 2010,2010,10,10,2016,French Champagne,287.0,750
Biserno Lodovico 2013,2013,5,5,2020,Tuscan Red,425.0,750
Château Latour Grand Vin Pauillac (Premier Grand Cru Classé) 1999,1999,4,4,2016,Bordeaux Médoc,1323.75,750
Château Pavie Macquin Saint-Émilion Grand Cru (Premier Grand Cru Classé) 2000,2000,7,7,2018,Bordeaux Saint-Émilion,287.5,750
Zýmē Kairos 2009,2009,8,8,2016,Northern Italy Red,221.25,750
Zýmē Kairos 2012,2012,5,5,2019,Northern Italy Red,221.25,750
Mascarello Giuseppe e Figlio Barolo Monprivato 2010,2010,2,2,2016,Italian Barolo,705.0,750
Mascarello Giuseppe e Figlio Barolo Monprivato 2010,2010,4,4,2017,Italian Barolo,705.0,750
Mascarello Giuseppe e Figlio Barolo Monprivato 2010,2010,8,8,2018,Italian Barolo,705.0,750
Le Macchiole Messorio 2010,2010,6,6,2016,Central Italy Red,533.75,750
Château Mouton Rothschild Pauillac (Premier Grand Cru Classé) 2010,2010,3,3,2017,Bordeaux Pauillac,1038.63,750
Château de Beaucastel Hommage à Jacques Perrin Châteauneuf-du-Pape 2011,2011,2,2,2018,Southern Rhône Châteauneuf-du-Pape Red,520.0,750
Château des Tours Vacqueyras 2011,2011,4,4,2019,Southern Rhône Red,250.0,750
Château des Tours Vacqueyras 2011,2011,1,1,2020,Southern Rhône Red,250.0,750
La Grange des Pères Vin de Pays de l'Hérault 2012,2012,1,1,2020,Languedoc-Roussillon Red,683.75,750
Il Marroneto Madonna delle Grazie Brunello di Montalcino 2010,2010,2,2,2017,Italian Brunello,1046.25,750
Il Marroneto Madonna delle Grazie Brunello di Montalcino 2010,2010,3,3,2018,Italian Brunello,1046.25,750
Vallone Graticciaia 2012,2012,7,7,2019,Southern Italy Red,111.25,750
Giacomo Conterno Barolo Cascina Francia 2012,2012,9,9,2019,Italian Barolo,420.0,750
Gaja Gaia & Rey Langhe 2006,2006,1,1,2016,Northern Italy White,472.5,375
Quintarelli Giuseppe Veneto Alzero Cabernet 2007,2007,4,4,2019,Northern Italy Red,683.75,750
Quintarelli Giuseppe Veneto Alzero Cabernet 2007,2007,3,3,2020,Northern Italy Red,683.75,750
Biserno Lodovico 2011,2011,8,8,2017,Central Italy Red,683.75,750
Biserno Lodovico 2011,2011,3,3,2018,Tuscan Red,683.75,750
Biserno Lodovico 2011,2011,6,6,2019,Tuscan Red,683.75,750
Vilafonté Series M 2014,2014,7,7,2019,South African Bordeaux Blend,48.0,750
Masseto Toscana 2010,2010,1,1,2017,Central Italy Red,4697.5,1500
Henri Giraud MV Rosé,N.V.,9,9,2019,French Champagne N.V.,293.8,750
Vilafonté Series M 2012,2012,3,3,2017,South African Bordeaux Blend,58.0,750
Vilafonté Series M 2012,2012,6,6,2018,South African Bordeaux Blend,58.0,750
Masseto Toscana 2006,2006,1,1,2020,Tuscan Red,4910.0,1500
Château Mouton Rothschild Le Petit Mouton de Mouton Rothschild Pauillac 2009,2009,10,10,2017,Bordeaux Pauillac,550.0,750
Masseto Toscana 2005,2005,1,1,2016,Central Italy Red,4697.5,1500
Masseto Toscana 2005,2005,2,2,2019,Tuscan Red,4697.5,1500
Masseto Toscana 2004,2004,1,1,2018,Tuscan Red,4163.75,1500
Valdicava Brunello di Montalcino Riserva Madonna del Piano 2010,2010,5,5,2018,Italian Brunello,736.25,1500
Cerbaiona Brunello di Montalcino 2012,2012,8,8,2019,Italian Brunello,276.25,750
Scarecrow Cabernet Sauvignon 2015,2015,1,1,2019,Napa Valley Cabernet Sauvignon,1558.75,750
Dominio de Pingus Pingus 2015,2015,3,3,2020,Spanish Ribera Del Duero Red,2028.75,750
La Spinetta Vürsù Barbaresco Gallina 2013,2013,10,10,2019,Italian Barbaresco,257.5,750
Tua Rita Redigaffi Toscana 2015,2015,10,10,2019,Tuscan Red,470.0,750
Tua Rita Redigaffi Toscana 2015,2015,8,8,2020,Tuscan Red,470.0,750
Achaval-Ferrer Finca Altamira Malbec 2015,2015,6,6,2020,Argentinian Malbec,99.95,750
Bonneau du Martray Corton-Charlemagne Grand Cru 2015,2015,1,1,2019,Burgundy Côte de Beaune White,811.25,750
Cardinale Red 2014,2014,9,9,2020,Napa Valley Bordeaux Blend,399.0,750
Charles Melton Nine Popes 2015,2015,1,1,2019,Australian Rhône Blend Red,114.6,750
Charles Melton Nine Popes 2015,2015,1,1,2020,Australian Rhône Blend Red,114.6,750
Hartenberg The Stork 2015,2015,6,6,2020,South African Syrah,57.95,750
Antinori Tignanello 2016,2016,10,10,2020,Tuscan Red,420.0,750
Roagna Pajè Barbaresco 2013,2013,4,4,2020,Italian Barbaresco,331.25,750
La Grange des Pères Vin de Pays de l'Hérault Blanc 2015,2015,1,1,2020,Languedoc-Roussillon White,961.25,750
Catena Zapata Adrianna Vineyard Mundus Bacillus Terrae Malbec 2014,2014,5,5,2020,Argentinian Malbec,295.0,750
Bodegas Tradición Palo Cortado Tradición Vors 30 Years Sherry,N.V.,1,1,2018,Spanish Sherry,99.95,750
Krug Grande Cuvée,N.V.,6,6,2020,French Champagne N.V.,245.0,750
